{
  "bundle_id": "bundle:m87:v0.1",
  "status": "incomplete",
  "objects": [
    {
      "kind": "claim",
      "id": "claim:m87:compact-radio-source",
      "path": "claim-compact-radio-source.json",
      "sha256": "0735a6866b90be2582da09f077feb8e3738b6af9f7fea47afd37d41fe78231c8"
    },
    {
      "kind": "claim",
      "id": "claim:m87:ring-image",
      "path": "claim-ring-image.json",
      "sha256": "cfc0057531c95a6cbed00999ddc66fd67a069ad3deda4f467c7e8b310e614d58"
    },
    {
      "kind": "claim",
      "id": "claim:m87:calibration-artifact",
      "path": "claim-alternative-calibration-artifact.json",
      "sha256": "31b7104f37260ea4ced934211302c211deaf68e56010be99bfc33cc80cdc7b32"
    },
    {
      "kind": "claim",
      "id": "claim:m87:imaging-prior-artifact",
      "path": "claim-alternative-imaging-prior.json",
      "sha256": "81b539015ea24779793a031d83a5f42d47629e817ed7cc1af2ad80f0f04a38e7"
    },
    {
      "kind": "claim",
      "id": "claim:m87:jet-only-morphology",
      "path": "claim-alternative-jet-only.json",
      "sha256": "36aa00836ecfb545b8eef090fa116569b71b47046dd26d1ed5fccafcbfc33f30"
    },
    {
      "kind": "claim",
      "id": "claim:m87:non-kerr-compact-object",
      "path": "claim-alternative-non-kerr.json",
      "sha256": "79e08450fe104409eea1da12d073ca0156ea78f07e98391922c169e6f1ddbb0e"
    },
    {
      "kind": "claim",
      "id": "claim:m87:variability-bias",
      "path": "claim-alternative-variability-bias.json",
      "sha256": "7dbb4550e9b58c1d386b1d2465a94c4272568e1eb7b2bacd747a236d2b26f774"
    },
    {
      "kind": "evidence",
      "id": "evidence:m87:calibrated-release-2019-D01-01",
      "path": "evidence-calibrated-release.json",
      "sha256": "90d0ea4af98adc0234e3da17238d7cade39dac5bfeda659a920beb2155384608"
    },
    {
      "kind": "evidence",
      "id": "evidence:m87:ehtim-bootstrap-reproduction",
      "path": "evidence-ehtim-bootstrap-reproduction.json",
      "sha256": "596a2733a7006fd875e3be460a3ac4249206724a4d68776fe3599a934e7fec89"
    },
    {
      "kind": "evidence",
      "id": "evidence:m87:ehtim-podman-runtime-confirmation",
      "path": "evidence-ehtim-podman-runtime-confirmation.json",
      "sha256": "2f62cab9486cd748cf062716c441b7b658bd8f3c1c045167856d98772cf7d458"
    },
    {
      "kind": "observation",
      "id": "observation:m87:ring-scale-structure",
      "path": "observation.json",
      "sha256": "5a9ad3b9ee13046b5fcbb7f66eb6c2a10471d17374e8b50a3f3117fa2f6f45b0"
    },
    {
      "kind": "instrument",
      "id": "instrument:eht:network",
      "path": "instrument.json",
      "sha256": "032d78665b2b36a13bdb7b0d4e39c07fdbb7bc32e3ff64e591d423ed5f485a20"
    },
    {
      "kind": "transformation",
      "id": "transformation:m87:image-reconstruction",
      "path": "transformation.json",
      "sha256": "c6e34aabe439cc6e852ac591f63c421e1939aa6e4e9330d82fc8b35d2ffb1132"
    },
    {
      "kind": "assumption",
      "id": "assumption:m87:gr-model",
      "path": "assumption.json",
      "sha256": "0c103806a9661befed3c7fbe60d225c221f442d22109a2529f8d7df82256f088"
    }
  ],
  "root_claim_refs": [
    "claim:m87:compact-radio-source",
    "claim:m87:ring-image"
  ],
  "missing": [
    "byte-for-byte equivalence with the CyVerse DOI endpoint",
    "pinned calibration pipeline commits and execution environment",
    "materially independent confirmation objects",
    "machine-readable falsification criteria"
  ]
}
